{
  "$schema": "https://json-schema.org/draft/2020-12/schema",
  "$id": "https://chromarelay.dev/schemas/handoff.schema.json",
  "title": "ChromaRelay Specialist Handoff",
  "type": "object",
  "additionalProperties": false,
  "required": ["version", "runId", "phase", "role", "agentId", "summary", "claims", "evidence", "artifacts", "decisions", "risks", "confidence", "requestedTransition", "unresolved"],
  "properties": {
    "version": { "const": "1.0" },
    "runId": { "type": "string" },
    "phase": { "type": "string" },
    "role": { "type": "string" },
    "agentId": { "type": "string" },
    "summary": { "type": "string", "minLength": 1 },
    "claims": {
      "type": "array",
      "items": {
        "type": "object",
        "additionalProperties": false,
        "required": ["claim", "status", "confidence", "evidenceRefs"],
        "properties": {
          "claim": { "type": "string" },
          "status": { "enum": ["observed", "inferred", "proposed"] },
          "confidence": { "enum": ["low", "medium", "high"] },
          "evidenceRefs": { "type": "array", "items": { "type": "string" } }
        }
      }
    },
    "evidence": { "type": "array", "items": { "type": "string" } },
    "artifacts": { "type": "array", "items": { "$ref": "artifact.schema.json" } },
    "decisions": { "type": "array", "items": { "$ref": "decision.schema.json" } },
    "risks": { "type": "array", "items": { "type": "string" } },
    "confidence": { "enum": ["low", "medium", "high"] },
    "requestedTransition": { "enum": ["advance", "branch", "return", "escalate", "stop"] },
    "requestedTarget": { "type": "string" },
    "unresolved": { "type": "array", "items": { "type": "string" } },
    "skill": {
      "description": "Which Skills the specialist actually used, in the same shape the Phase Packet offers them, so offered and used are directly comparable. `supporting` honours the run's supporting-skill budget of 2.",
      "type": "object",
      "additionalProperties": false,
      "required": ["primary", "supporting"],
      "properties": {
        "primary": { "type": ["string", "null"], "minLength": 1 },
        "supporting": { "type": "array", "maxItems": 2, "items": { "type": "string", "minLength": 1 } }
      }
    },
    "telemetry": {
      "description": "Quantitative resource report from the agent's harness. Every field is optional: a harness that cannot observe a resource omits it, and the audit reads that as an explicit unknown rather than a zero. Aggregated per Phase and per Role in the audit view.",
      "type": "object",
      "additionalProperties": false,
      "properties": {
        "tools": {
          "description": "Tool name -> invocation count for this agent during this phase.",
          "type": "object",
          "additionalProperties": { "type": "integer", "minimum": 1 }
        },
        "inputTokens": { "type": "integer", "minimum": 0 },
        "outputTokens": { "type": "integer", "minimum": 0 }
      }
    }
  }
}
