{
  "version": "1.0",
  "runId": "run-cli-landing-001",
  "phase": "grounding",
  "role": "product-strategist",
  "agentId": "product-strategist-01",
  "summary": "Established user, task, product truth, desired perception, and constraint draft for the watchtest landing page. Two ambiguities (brand assets, pricing) explicitly accepted as open.",
  "claims": [
    {
      "claim": "The primary user already owns a test suite and wants the feedback loop closed, not a new test framework.",
      "status": "inferred",
      "confidence": "medium",
      "evidenceRefs": [
        ".chromarelay/runs/run-cli-landing-001/artifacts/product-brief.md"
      ]
    },
    {
      "claim": "The decisive action on this surface is copying the install command within 30 seconds.",
      "status": "proposed",
      "confidence": "medium",
      "evidenceRefs": [
        ".chromarelay/runs/run-cli-landing-001/artifacts/product-brief.md"
      ]
    }
  ],
  "evidence": [
    ".chromarelay/runs/run-cli-landing-001/artifacts/product-brief.md"
  ],
  "artifacts": [
    {
      "id": "product-brief",
      "kind": "product-brief",
      "path": ".chromarelay/runs/run-cli-landing-001/artifacts/product-brief.md",
      "status": "proposed",
      "producerRole": "product-strategist",
      "agentId": "product-strategist-01",
      "runId": "run-cli-landing-001",
      "phase": "grounding",
      "createdAt": "2026-08-24T18:30:00.000Z",
      "sourceRefs": [
        ".chromarelay/runs/run-cli-landing-001/request.json"
      ]
    }
  ],
  "decisions": [],
  "risks": [
    "No real brand assets exist; direction work has no prior visual anchor."
  ],
  "confidence": "medium",
  "requestedTransition": "advance",
  "unresolved": [
    "pricing model",
    "brand assets"
  ]
}
