{
  "version": "1.0",
  "runId": "run-cli-landing-001",
  "phase": "deterministic-audit",
  "role": "deterministic-auditor",
  "agentId": "deterministic-auditor-01",
  "summary": "Measured five declared gates with Chromium DOM and computed-style probes. build-health, token-drift, responsive-geometry and state-coverage pass. accessibility fails on two counts: zero heading elements and --ink-dim at 4.49:1. axe-core is not installed, and the required 'state captures' output could not be produced.",
  "claims": [
    {
      "claim": "The page contains zero heading elements; h1 count is 0 and total headings is 0.",
      "status": "observed",
      "confidence": "high",
      "evidenceRefs": [
        ".chromarelay/runs/run-cli-landing-001/artifacts/audit-report.md"
      ]
    },
    {
      "claim": "--ink-dim resolves to rgb(111,111,112) on paper rgb(244,242,237), a contrast ratio of 4.49:1, which fails WCAG AA for the 13px and 15px text it is applied to.",
      "status": "observed",
      "confidence": "high",
      "evidenceRefs": [
        ".chromarelay/runs/run-cli-landing-001/artifacts/audit-report.md"
      ]
    },
    {
      "claim": "Token drift is zero: all 3 hex literals in the file sit inside custom property declarations, and the 7 literal px values are structural rather than color or type.",
      "status": "observed",
      "confidence": "high",
      "evidenceRefs": [
        ".chromarelay/runs/run-cli-landing-001/artifacts/audit-report.md"
      ]
    },
    {
      "claim": "axe-core, declared in the phase kit with authority deterministic-evidence, is not installed; the accessibility gate ran on DOM probes instead.",
      "status": "observed",
      "confidence": "high",
      "evidenceRefs": [
        ".chromarelay/runs/run-cli-landing-001/artifacts/audit-report.md"
      ]
    },
    {
      "claim": "The declared output 'state captures' was not produced, because --screenshot alone cannot drive interaction before capture.",
      "status": "observed",
      "confidence": "high",
      "evidenceRefs": [
        ".chromarelay/runs/run-cli-landing-001/artifacts/audit-report.md"
      ]
    },
    {
      "claim": "shot-375.png is invalid as mobile evidence: headless=new pinned innerWidth at 500px, so the page was laid out at 500 and cropped to 375.",
      "status": "observed",
      "confidence": "high",
      "evidenceRefs": [
        ".chromarelay/runs/run-cli-landing-001/artifacts/audit-report.md"
      ]
    }
  ],
  "evidence": [
    ".chromarelay/runs/run-cli-landing-001/artifacts/audit-report.md",
    ".chromarelay/runs/run-cli-landing-001/artifacts/shot-1440.png",
    ".chromarelay/runs/run-cli-landing-001/artifacts/index.html"
  ],
  "artifacts": [
    {
      "id": "audit-report",
      "kind": "audit-report",
      "path": ".chromarelay/runs/run-cli-landing-001/artifacts/audit-report.md",
      "status": "proposed",
      "producerRole": "deterministic-auditor",
      "agentId": "deterministic-auditor-01",
      "runId": "run-cli-landing-001",
      "phase": "deterministic-audit",
      "createdAt": "2026-08-24T18:50:00.000Z",
      "sourceRefs": [
        ".chromarelay/runs/run-cli-landing-001/artifacts/index.html"
      ],
      "evidenceRefs": [
        ".chromarelay/runs/run-cli-landing-001/artifacts/shot-1440.png"
      ]
    }
  ],
  "decisions": [],
  "risks": [
    "Two of five gates in this phase were measured with an instrument weaker than the one the kit declares.",
    "A declared phase output is missing and nothing in the system detects that."
  ],
  "confidence": "high",
  "requestedTransition": "advance",
  "unresolved": [
    "no heading element — accessibility blocker",
    "--ink-dim at 4.49:1 — accessibility blocker",
    "state captures not produced — capability gap"
  ]
}
