{
  "version": "1.0",
  "runId": "run-cli-landing-001",
  "phase": "promotion",
  "role": "memory-curator",
  "agentId": "memory-curator-01",
  "summary": "Promotion could not be executed: the CLI has no promote command, the implementation lives in an OMP tool excluded from the build whose dependency is absent from package.json, and .chromarelay/project was never created. Separately, nothing in the Run was approvable — all 9 artifacts and 3 decisions carry status proposed.",
  "claims": [
    {
      "claim": "The CLI exposes no promote command; grep -n promote src/cli.ts returns no matches.",
      "status": "observed",
      "confidence": "high",
      "evidenceRefs": [
        ".chromarelay/runs/run-cli-landing-001/artifacts/promotion-manifest.md"
      ]
    },
    {
      "claim": ".omp/tools/chromarelay-state.ts does not compile standalone: @oh-my-pi/pi-coding-agent is not in package.json and tsconfig excludes .omp/**/*.ts.",
      "status": "observed",
      "confidence": "high",
      "evidenceRefs": [
        ".chromarelay/runs/run-cli-landing-001/artifacts/promotion-manifest.md"
      ]
    },
    {
      "claim": ".chromarelay/project/ was never created by start or advance, and promote requires the destination to be inside it.",
      "status": "observed",
      "confidence": "high",
      "evidenceRefs": [
        ".chromarelay/runs/run-cli-landing-001/artifacts/promotion-manifest.md"
      ]
    },
    {
      "claim": "All 9 artifacts and all 3 decisions in this Run carry status 'proposed'; no phase, gate or command transitions a record to approved.",
      "status": "observed",
      "confidence": "high",
      "evidenceRefs": [
        ".chromarelay/runs/run-cli-landing-001/artifacts/promotion-manifest.md"
      ]
    },
    {
      "claim": "A decision with scope project, status approved, approvedBy equal to its own author and empty evidence was accepted by the CLI and written verbatim to decisions/.",
      "status": "observed",
      "confidence": "high",
      "evidenceRefs": [
        ".chromarelay/runs/run-cli-landing-001/artifacts/promotion-manifest.md"
      ]
    },
    {
      "claim": "The provenance chain itself is complete: 12 handoffs, 21 events, and sourceRefs on every artifact.",
      "status": "observed",
      "confidence": "high",
      "evidenceRefs": [
        ".chromarelay/runs/run-cli-landing-001/events.jsonl"
      ]
    }
  ],
  "evidence": [
    ".chromarelay/runs/run-cli-landing-001/artifacts/promotion-manifest.md",
    ".chromarelay/runs/run-cli-landing-001/events.jsonl"
  ],
  "artifacts": [
    {
      "id": "promotion-manifest",
      "kind": "promotion-manifest",
      "path": ".chromarelay/runs/run-cli-landing-001/artifacts/promotion-manifest.md",
      "status": "proposed",
      "producerRole": "memory-curator",
      "agentId": "memory-curator-01",
      "runId": "run-cli-landing-001",
      "phase": "promotion",
      "createdAt": "2026-08-24T19:06:00.000Z",
      "sourceRefs": [
        ".chromarelay/runs/run-cli-landing-001/run.json"
      ]
    }
  ],
  "decisions": [],
  "risks": [
    "The terminal phase of the flagship workflow is reachable in state but not executable through the interface that ran the other thirteen phases."
  ],
  "confidence": "high",
  "requestedTransition": "advance",
  "unresolved": [
    "promotion is not executable outside OMP",
    "no mechanism exists to approve an artifact or decision",
    "gate promotion-readiness has no executor"
  ]
}
