{
  "version": "1.0",
  "runId": "run-cli-landing-001",
  "phase": "visual-critique",
  "role": "visual-critic",
  "agentId": "visual-critic-02",
  "summary": "First phase in this Run to judge pixels rather than prose. Verdict: repairable, 35/45, with four findings. Two of the Run's captures are unusable: one laid out at 500px and cropped to 375, one caught the hero mid-animation showing 10ms instead of 41ms. The declared independence control was violated with nothing preventing it.",
  "claims": [
    {
      "claim": "The independence control 'detector report withheld until first verdict' was violated: the audit report was read before the verdict, and no mechanism sequences the two.",
      "status": "observed",
      "confidence": "high",
      "evidenceRefs": [
        ".chromarelay/runs/run-cli-landing-001/phase-packets/visual-critique.json"
      ]
    },
    {
      "claim": "shot-full.png renders the headline claim as 10ms instead of 41ms because the capture caught the count-up animation mid-flight.",
      "status": "observed",
      "confidence": "high",
      "evidenceRefs": [
        ".chromarelay/runs/run-cli-landing-001/artifacts/shot-full.png",
        ".chromarelay/runs/run-cli-landing-001/artifacts/visual-review.md"
      ]
    },
    {
      "claim": "Six unfrozen captures at the same viewport produce three distinct md5 hashes; with animation frozen, four captures produce one. The earlier 3/3 identical result was a frame collision, not determinism.",
      "status": "observed",
      "confidence": "high",
      "evidenceRefs": [
        ".chromarelay/runs/run-cli-landing-001/artifacts/visual-review.md"
      ]
    },
    {
      "claim": "The three repeated 200px vertical gaps read as emptiness rather than rhythm in the full-page render, with roughly 700px of blank space below the footer.",
      "status": "observed",
      "confidence": "high",
      "evidenceRefs": [
        ".chromarelay/runs/run-cli-landing-001/artifacts/shot-full.png",
        ".chromarelay/runs/run-cli-landing-001/artifacts/visual-review.md"
      ]
    },
    {
      "claim": "This finding could not have been produced from the prose specimen, which described the same gap as deliberate scarcity.",
      "status": "inferred",
      "confidence": "medium",
      "evidenceRefs": [
        ".chromarelay/runs/run-cli-landing-001/artifacts/visual-specimens.md",
        ".chromarelay/runs/run-cli-landing-001/artifacts/visual-review.md"
      ]
    },
    {
      "claim": "The rubric was again derived from run.surfaceClass by the critic; the packet contains no rubric path.",
      "status": "observed",
      "confidence": "high",
      "evidenceRefs": [
        ".chromarelay/runs/run-cli-landing-001/phase-packets/visual-critique.json"
      ]
    }
  ],
  "evidence": [
    ".chromarelay/runs/run-cli-landing-001/artifacts/visual-review.md",
    ".chromarelay/runs/run-cli-landing-001/artifacts/shot-1440-frozen.png",
    ".chromarelay/runs/run-cli-landing-001/artifacts/shot-full.png",
    "framework/rubrics/persuade.json"
  ],
  "artifacts": [
    {
      "id": "visual-review",
      "kind": "visual-review",
      "path": ".chromarelay/runs/run-cli-landing-001/artifacts/visual-review.md",
      "status": "proposed",
      "producerRole": "visual-critic",
      "agentId": "visual-critic-02",
      "runId": "run-cli-landing-001",
      "phase": "visual-critique",
      "createdAt": "2026-08-24T18:56:00.000Z",
      "sourceRefs": [
        ".chromarelay/runs/run-cli-landing-001/artifacts/shot-1440-frozen.png",
        "framework/rubrics/persuade.json"
      ],
      "evidenceRefs": [
        ".chromarelay/runs/run-cli-landing-001/artifacts/shot-full.png"
      ]
    }
  ],
  "decisions": [
    {
      "id": "DEC-003-visual-verdict",
      "scope": "surface",
      "status": "proposed",
      "choice": "Repairable. Four findings (vertical rhythm, unit sizing, count-up animation, orphaned primary action) form one repair batch together with the two accessibility blockers from the audit.",
      "rationale": [
        "All four findings are adjustments inside the selected Direction; none requires a new Direction.",
        "Scores 35/45 with hierarchy, specificity and coherence at 5, so the thesis is working; the losses are in composition and craft.",
        "The count-up finding is grounded in measured harm to the Run's own evidence, not in a preference about motion."
      ],
      "alternatives": [
        "Structural return — rejected; no finding implicates the Direction itself.",
        "Approve as-is — rejected; two accessibility blockers and a headline claim that renders wrong."
      ],
      "evidence": [
        ".chromarelay/runs/run-cli-landing-001/artifacts/visual-review.md",
        ".chromarelay/runs/run-cli-landing-001/artifacts/audit-report.md"
      ],
      "risks": [
        "This verdict was formed after reading the detector report, which the packet forbade.",
        "Repetition stability of this verdict was never measured."
      ],
      "revisitWhen": [
        "the repair batch lands and a frozen capture can be compared against shot-1440-frozen.png"
      ]
    }
  ],
  "risks": [
    "A critic who had only the prose specimen would have scored composition higher and missed the strongest finding in this review."
  ],
  "confidence": "medium",
  "requestedTransition": "advance",
  "unresolved": [
    "gate visual-quality has no executor and no threshold is computed for the Surface class",
    "repetition stability of this verdict is unmeasured"
  ]
}
